{
  "$schema": "http://json-schema.org/draft-07/schema#",
  "title": "Wyltek Infographic Template",
  "type": "object",
  "required": ["id", "name", "description", "slots", "prompt_template"],
  "properties": {
    "id":          {"type": "string", "pattern": "^[a-z][a-z0-9_]*$"},
    "name":        {"type": "string", "minLength": 1, "maxLength": 60},
    "description": {"type": "string", "minLength": 1, "maxLength": 240},
    "preview":     {"type": "string"},
    "slots":       {"type": "array", "items": {"$ref": "#/definitions/slot"}},
    "prompt_template": {"type": "string", "minLength": 1}
  },
  "additionalProperties": false,
  "definitions": {
    "slot": {
      "type": "object",
      "required": ["id", "type"],
      "properties": {
        "id":       {"type": "string", "pattern": "^[a-z][a-z0-9_]*$"},
        "type":     {"enum": ["text", "image_ref", "color", "list", "enum"]},
        "label":    {"type": "string"},
        "required": {"type": "boolean"},
        "max_len":  {"type": "integer", "minimum": 1},
        "min":      {"type": "integer", "minimum": 0},
        "max":      {"type": "integer", "minimum": 1},
        "choices":  {"type": "array", "items": {"type": "string"}},
        "item_slots": {"type": "array", "items": {"$ref": "#/definitions/slot"}}
      },
      "additionalProperties": false,
      "allOf": [
        {
          "if":   {"properties": {"type": {"const": "enum"}}, "required": ["type"]},
          "then": {"required": ["choices"]}
        }
      ]
    }
  }
}
