{
  "id": "freeform",
  "name": "Free-form (no template)",
  "description": "Direct prompt — no slots, no structure. Best when you know exactly what you want, or for non-infographic generations. Image-reference chips still work and insert [Image N] tokens at the cursor.",
  "preview": "templates/infographics/_previews/freeform.png",
  "slots": [
    {"id": "prompt", "type": "text", "label": "Prompt", "max_len": 2000, "required": true}
  ],
  "prompt_template": "{{prompt}}"
}
