{
  "id": "map",
  "name": "Geographic Map",
  "description": "Map with regional overlays.",
  "preview": "templates/infographics/_previews/map.png",
  "slots": [
    {"id": "title", "type": "text", "max_len": 60, "required": true},
    {"id": "region", "type": "enum", "label": "Region",
     "choices": ["world", "north_america", "south_america", "europe", "africa", "asia", "oceania"],
     "required": true},
    {"id": "overlays", "type": "list", "min": 2, "max": 12,
     "item_slots": [
       {"id": "location", "type": "text", "max_len": 40, "required": true},
       {"id": "label", "type": "text", "max_len": 24, "required": true},
       {"id": "value", "type": "text", "max_len": 40, "required": false},
       {"id": "image", "type": "image_ref"}
     ]}
  ],
  "prompt_template": "A geographic-map infographic titled \"{{title}}\", flat illustration on cream paper, thick black outlines. Stylized cartoon map of the {{region}} region (recognizable silhouette, no realistic geography needed). Overlay markers:{{#overlays}} \"{{location}}\" — {{label}}{{#value}} ({{value}}){{/value}}{{#image}} illustrated with {{image}}{{/image}};{{/overlays}} Each marker a circular pastel badge connected to its region by a thin black leader line; soft drop shadows."
}
