{
  "id": "comparison",
  "name": "Comparison / vs.",
  "description": "Two side-by-side columns. Best for before/after, A vs B, pros/cons.",
  "preview": "templates/infographics/_previews/comparison.png",
  "slots": [
    {
      "id": "title",
      "type": "text",
      "label": "Title",
      "max_len": 200,
      "required": true
    },
    {
      "id": "left",
      "type": "list",
      "label": "Left column",
      "min": 1,
      "max": 1,
      "item_slots": [
        {
          "id": "heading",
          "type": "text",
          "label": "Heading",
          "max_len": 120,
          "required": true
        },
        {
          "id": "bullets",
          "type": "list",
          "min": 3,
          "max": 5,
          "item_slots": [
            {
              "id": "text",
              "type": "text",
              "max_len": 240,
              "required": true
            }
          ]
        }
      ]
    },
    {
      "id": "right",
      "type": "list",
      "label": "Right column",
      "min": 1,
      "max": 1,
      "item_slots": [
        {
          "id": "heading",
          "type": "text",
          "label": "Heading",
          "max_len": 120,
          "required": true
        },
        {
          "id": "bullets",
          "type": "list",
          "min": 3,
          "max": 5,
          "item_slots": [
            {
              "id": "text",
              "type": "text",
              "max_len": 240,
              "required": true
            }
          ]
        }
      ]
    }
  ],
  "prompt_template": "A side-by-side comparison infographic titled \"{{title}}\", flat illustration on cream paper with thick black outlines and gentle drop shadows. Two equal columns separated by a center divider.{{#left}} Left column titled \"{{heading}}\":{{#bullets}} \u2022 {{text}};{{/bullets}}{{/left}}{{#right}} Right column titled \"{{heading}}\":{{#bullets}} \u2022 {{text}};{{/bullets}}{{/right}} Balanced composition; monospaced bullets."
}
