{
  "id": "hub_and_spoke",
  "name": "Hub & Spoke",
  "description": "Central concept with N radiating spokes. Best for feature overviews.",
  "preview": "templates/infographics/_previews/hub_and_spoke.png",
  "slots": [
    {
      "id": "title",
      "type": "text",
      "label": "Title",
      "max_len": 200,
      "required": true
    },
    {
      "id": "hub_desc",
      "type": "text",
      "label": "Hub concept",
      "max_len": 600,
      "required": true
    },
    {
      "id": "spokes",
      "type": "list",
      "label": "Spokes",
      "min": 4,
      "max": 8,
      "item_slots": [
        {
          "id": "label",
          "type": "text",
          "label": "Label",
          "max_len": 80,
          "required": true
        },
        {
          "id": "tagline",
          "type": "text",
          "label": "Tagline",
          "max_len": 240,
          "required": false
        },
        {
          "id": "color",
          "type": "color",
          "label": "Color",
          "required": false
        }
      ]
    }
  ],
  "prompt_template": "An infographic titled \"{{title}}\", playful flat illustration on cream paper with thick black outlines. Hub-and-spoke layout: a central focal point with equidistant radiating spokes arranged clockwise, soft drop shadows, dotted-grid background. Center hub: {{hub_desc}}.{{#hub_image}} Hub illustration reference: [Image 1].{{/hub_image}} Spokes:{{#spokes}} A circular badge{{#color}} in {{color}}{{/color}} containing {{label}}{{#tagline}} (tagline \"{{tagline}}\"){{/tagline}};{{/spokes}} High balance, generous white space, professional approachable visual flow."
}
