{
  "id": "list",
  "name": "List / N Things",
  "description": "Vertical list of N points. Best for '5 reasons', 'key takeaways', checklists.",
  "preview": "templates/infographics/_previews/list.png",
  "slots": [
    {
      "id": "title",
      "type": "text",
      "max_len": 200,
      "required": true
    },
    {
      "id": "intro",
      "type": "text",
      "max_len": 600,
      "required": false
    },
    {
      "id": "rows",
      "type": "list",
      "min": 3,
      "max": 7,
      "item_slots": [
        {
          "id": "label",
          "type": "text",
          "max_len": 120,
          "required": true
        },
        {
          "id": "description",
          "type": "text",
          "max_len": 240,
          "required": false
        }
      ]
    }
  ],
  "prompt_template": "A vertical list infographic titled \"{{title}}\"{{#intro}} with intro \"{{intro}}\"{{/intro}}, flat illustration on cream paper, thick black outlines. Numbered rows:{{#rows}} \"{{label}}\"{{#description}} \u2014 {{description}}{{/description}};{{/rows}} Each row a horizontal pill with circular numbered badge on left; soft drop shadows; rounded sans-serif labels; monospaced descriptions."
}
